source_id,source_name,role,planned_use,access_method,licence_or_terms_note,status,url
SRC_FAOSTAT_DOS,FAOSTAT / FAO drained organic soils statistics,core_country_statistics,Country-level drained organic soil area and GHG emissions for hotspot ranking.,FAOSTAT API or bulk download; fallback: FAO/GHG Earth Engine layers.,Check FAO/FAOSTAT terms at fetch time; commit only derived country table.,priority_for_B2,https://www.fao.org/faostat/en/
SRC_FAO_DROSA_GEE,FAO/GHG/1/DROSA_A Drained Organic Soils Area,geospatial_area_fallback,Fallback or validation source for area of drained organic soils at approx. 1 km resolution.,Google Earth Engine dataset.,Check Earth Engine/FAO terms; commit only derived outputs.,fallback_or_validation,https://developers.google.com/earth-engine/datasets/catalog/FAO_GHG_1_DROSA_A
SRC_FAO_DROSE_GEE,FAO/GHG/1/DROSE_A Drained Organic Soils Emissions,geospatial_emissions_fallback,Fallback or validation source for C and N2O emissions from drained organic soils.,Google Earth Engine dataset.,Check Earth Engine/FAO terms; commit only derived outputs.,fallback_or_validation,https://developers.google.com/earth-engine/datasets/catalog/FAO_GHG_1_DROSE_A
SRC_GPM2,Global Peatland Map 2.0 / Global Peatland Database,global_peatland_extent,Optional peatland extent context for later Phase B/B3.,Download grid from Greifswald Mire Centre / Global Peatland Database.,Check download terms and attribution; do not commit heavy raw rasters.,optional_after_FAOSTAT,https://greifswaldmoor.de/global-peatland-database-en.html
SRC_NATURAL_EARTH,Natural Earth Admin 0 Countries,country_boundaries,Lightweight world country boundaries for web choropleth.,Download 110m or 50m Admin 0 countries; convert/simplify to GeoJSON if needed.,Natural Earth states it is public domain/free for use; include attribution/source note.,priority_for_B3,https://www.naturalearthdata.com/downloads/
