decision_area,preferred_option,fallback_option,decision_needed,risk,status
administrative boundaries,"Landkreisgrenzen for Ravensburg, Biberach, Sigmaringen, Bodenseekreis",NUTS/LAU/generalised administrative boundaries,Which boundary source is already in the project and legally safe for public display?,low,open
agricultural land-use layer,Official agricultural land-use data with crop/grassland classes if public or project-usable,ATKIS/LBM-DE/CORINE/generalised land-cover layer,Can we legally use detailed agricultural polygons or only a coarser public land-cover layer?,high,open
moor/organic/wetland soil context,Best available regional official layer: Moorkataster if usable; otherwise BK50/organic soil context,Existing BK50-derived BW layer already used in the atlas,Which layer is fachlich strongest and license-safe for public prototype use?,high,open
intersection calculation,"GIS overlay agriculture ∩ soil/moor context, area aggregated by district",visual-only overlay without numeric aggregation,"Do we calculate hectares and shares now, or first publish visual context only?",medium,open
resolution/generalisation,"generalised enough for public communication, detailed enough to show spatial pattern",district-level aggregated bars/tables without exact polygons,How detailed may public display be without implying farm-level affectedness?,medium,open
legend wording,Landwirtschaftliche Nutzung; Moor-/Feuchtbodenkontext; Schnittmenge Nutzung × Kontext,Bodenkontext; Nutzungskontext; Umsetzungsraum,Choose wording that cannot be misread as suitability or priority.,medium,open
SOLAMO link,"Use SOLAMO as socio-economic bridge, not as completed-results claim",Keep SOLAMO only in documentation until project wording is approved,How explicitly should SOLAMO be named in the public page?,medium,open
