section_id,chapter_order,chapter_slug,title,subtitle,story_text,main_message,visualisation_type,primary_view,interaction_note,required_data,current_data_status,related_paper_ids,related_pathway_ids,related_region_ids,callout_text,portfolio_angle,design_reference,mvp_priority,implementation_risk,data_risk,notes
S01,1,hidden-climate-hotspot,The hidden climate hotspot,"Small areas, disproportionate emissions","Drained agricultural peatlands are not only ecological remnants. Where organic soils, drainage and farming overlap, they become climate-relevant production landscapes. The Atlas starts by locating this overlap before asking which transitions are possible.","Drained agricultural peatlands are climate hotspots because peat, drainage and production overlap.",scrollytelling_map_hotspots,Global-to-European map zoom,"Start with a global map, then zoom to Europe and South Germany. Toggle peatland extent, drained organic soils, agricultural land cover and emissions if public layers are available.",country_hotspots.csv|global_peatland_extent|drained_organic_soils_emissions|natural_earth_boundaries,external_data_needed,P001|P021|P005,T01|T08,R009|R004,"The hotspot is hydrological, agricultural and economic — not only ecological.",Creates an accessible opening frame and prepares the shift from hotspot mapping to transition design.,Maritime Chokepoints / What's That Smell?,high,medium,medium,"For MVP, use country-level FAOSTAT/FAO data before attempting large raster workflows."
S02,2,water-table-lever,The water table is the lever,Area alone does not determine mitigation,"Peatland mitigation depends on the water table that can actually be achieved. The same mapped peatland area can lead to different climate, management and production outcomes depending on groundwater level, soil conditions and land-use intensity.","The decisive variable is not peatland area alone, but achievable water-table depth.",interactive_water_table_slider,Water-table gradient with linked outcome cards,"User drags a water-table slider from deeply drained to near-surface conditions. Cards update for CO2, CH4 risk, trafficability, production continuity and feasible land-use pathways.",transition_pathways.csv|papers.csv|water_table_effect_rules.csv,partly_available,P006|P007|P008|P009|P010|P011,T01|T02|T03|T04|T05|T08,R001|R002|R003,A hectare of peatland is not a uniform mitigation unit.,Turns a technical hydrological mechanism into a simple interactive explanation.,Confluence Diagram / Life of Plastic,high,low,low,Can be implemented with qualitative rules first; quantitative functions can be added later.
S03,3,international-evidence-map,Evidence from elsewhere,International studies as a structured evidence layer,"Different countries contribute different pieces of the transition puzzle: Dutch studies highlight raised groundwater, peat pasture and trafficability; Finnish studies model incentives and compensation; Danish studies test biomass pathways; German and UK studies add adoption, governance and productive-peatland perspectives.",International evidence does not provide one solution; it provides transferable lessons.,interactive_evidence_map,Map with evidence-region nodes and paper cards,"Click a region node to open a card with supporting papers, key message, pathway relevance, South Germany transfer note and caveat. Filter by hydrology, economics, biomass, grazing, adoption and governance.",region_case_studies.geojson|papers.csv|transition_pathways.csv,available,P004|P006|P007|P008|P009|P010|P011|P014|P016|P017|P018,T02|T03|T04|T05|T06|T07|T08,R001|R002|R003|R004|R005|R006|R007|R008|R011,"The Atlas treats papers as evidence nodes, not as isolated references.",Converts a literature review into a navigable evidence map.,Tree Stories / Circle of Nations,high,low,low,This is the best first interactive prototype because all required datasets are already available.
S04,4,transition-pathways,The transition space,Between drained farming and full restoration,"Rewetting should not be visualised as a binary choice between current farming and complete restoration. The literature describes a transition space: partial water management, raised-water-table pasture, wet mowing, wet biomass, reed value chains, robust grazing and restoration.","The design space is a spectrum of wetter land-use pathways, each with different trade-offs.",pathway_spectrum_matrix,Horizontal wetness-gradient diagram plus comparison matrix,"User selects a pathway. The matrix highlights GHG potential, water-table requirement, trafficability constraint, farm compatibility, market maturity, adoption barrier and South Germany fit.",transition_pathways.csv|papers.csv,available,P001|P002|P003|P004|P006|P008|P009|P014|P015|P016|P017|P020|P021,T01|T02|T03|T04|T05|T06|T07|T08,R001|R003|R006|R007|R009|R010,The key question is what kind of agriculture remains possible under wetter conditions.,Provides the central conceptual graphic of the portfolio piece.,Confluence Diagram / Life of Plastic,very_high,low,low,Scores are qualitative and must be clearly labelled as literature-informed expert coding.
S05,5,south-germany-fit,What fits South Germany?,From evidence to transfer hypotheses,"Not every wet land-use pathway is equally plausible in South German dairy, forage and biogas regions. The Atlas translates international evidence into transfer hypotheses, asking which pathways might align with hydrology, machinery access, farm structure, markets and adoption conditions.",South Germany needs transition pathways that connect mitigation with recognisable farm systems.,south_germany_fit_bubble_matrix,Bubble chart: hydrological requirement × farm compatibility; size = GHG potential; colour = adoption/market risk,"Hover on each pathway to show supporting papers and caveats. Toggle criteria: farm compatibility, market maturity, trafficability, adoption barrier.",transition_pathways.csv|papers.csv|regional_context_layers_optional,available_for_qualitative_mvp,P008|P009|P014|P015|P016|P017|P020,T03|T04|T05|T06|T07,R001|R003|R005|R006|R007|R008,"A pathway can be scientifically plausible and still fail without farm compatibility, machinery access or markets.",Turns the Atlas into a decision-support style view for regional transition discussion.,Out of Reach / Tree Stories,high,low,medium,A first version can be literature-only; later add Thünen/LGRB/Copernicus regional layers.
S06,6,modelling-frontier,The modelling frontier,Where the atlas meets research infrastructure,"The literature provides building blocks, but local decisions require integrated modelling. Hydrology determines achievable water tables; water tables shape emissions; farm structure shapes economic exposure; and viable pathways determine whether rewetting can become implementable.","The next decision tools must connect hydrology, GHG mitigation, farm economics and viable land use.",conceptual_dependency_diagram,Hydrology → water table → GHG mitigation → farm exposure → transition pathway diagram,"Click each node to reveal data requirements, current evidence and remaining gaps. Optional: link to PALUD/RoGeR research context without exposing sensitive data.",papers.csv|transition_pathways.csv|methodology_notes|future_model_outputs_optional,available_for_conceptual_mvp,P001|P006|P010|P011|P016|P018|P021,T02|T03|T04|T08,R001|R002|R005|R011,"A peatland map is not enough; the decision unit is the interaction of water, emissions, farms and transition options.",Connects the public-facing Atlas to future hydrological-economic modelling.,Confluence Diagram,medium,low,low,This section can be mostly explanatory in the MVP.
